City,Company,Location,Reviews,Salary,Summary,Title,Indeed_Estimate
Austin,Prestige Staffing,"Austin, TX 78759 (Arboretum area)",127,120000,Responsible for coaching and leading the Data Scientists who work under you to solve problems through analytics and customer data. Data Science Manager....,Data Science Manager,0
Austin,Pisika,"Austin, TX 78758 (North Austin area)",,95000,"Build dashboards, data visualizations, and tools for online marketing. Write scripts to automate data processing and other recurring tasks....",Data Scientist,0
Austin,Prestige Staffing,"Austin, TX 78759 (Arboretum area)",127,125000,"Python, Lab, Data Science, consulting, computer science, AI, automation, principal data scientist. Masters/PhD in Physics, data science, industrial engineering,...",Data Scientist,0
Austin,Meador Staffing of Austin,"Austin, TX",,137500,"Experience in big data and machine learning systems, such as Spark, Scala etc. PhD, or MS in Statistics, Math, Physics or Computer Science or related fields,...",Online Marketing Scientist/Engineer,0
Austin,General Assembly,"Austin, TX",131,142500,"We are looking for a Data Scientist to facilitate our local class. You are eager to shape the skills, minds, and trajectories of the newest generation of data...",Lead Data Science Immersive Instructor,1
Austin,DMGT,"Austin, TX",3,116000,Senior Data Scientist. The Senior Data Scientist is a multi-disciplinary specialist. The A Player Data Scientist is the following:....,Senior Data Scientist,1
Austin,SparkCognition,"Austin, TX 78759 (Arboretum area)",3,110000,SparkCognition is seeking an innovative data scientist to join the DeepArmor team. Building automated tools that enable data scientists to more effectively...,Senior Data Scientist – Malware & Security,1
